[
  {
    "case_id": "SCBD-AD-2015-001",
    "case_title": "Abdul Jalil and others vs Md. Joynal Abedin and others",
    "citation": "67 DLR (AD) 142",
    "court_division": "Appellate Division",
    "year": 2015,
    "judgment_date": "2015-05-18",
    "bench_judges": ["Surendra Kumar Sinha CJ", "Md. Abdul Wahhab Miah J", "Nazmun Ara Sultana J"],
    "subject_area": "Property & Land Law",
    "governing_statutes": [
      {
        "act_name": "The Transfer of Property Act, 1882",
        "sections": ["54", "54A"]
      },
      {
        "act_name": "The Registration Act, 1908",
        "sections": ["17A", "49"]
      },
      {
        "act_name": "The Specific Relief Act, 1877",
        "sections": ["21A"]
      }
    ],
    "facts_summary": "The plaintiffs sought specific performance of an unregistered contract for sale executed in 2006. The defendants contended that following the 2004 amendments introducing Section 54A in the Transfer of Property Act, Section 17A in the Registration Act, and Section 21A in the Specific Relief Act, no suit for specific performance lies on an unregistered contract for sale.",
    "legal_issues": [
      "Whether an unregistered agreement for sale executed after the 2004 amendment can be enforced through a suit for specific performance in civil court."
    ],
    "ratio_decidendi": "An agreement for sale of immovable property executed after the 2004 amendment must be compulsorily registered. An unregistered contract for sale is completely barred from being specifically enforced in civil court under Section 21A of the Specific Relief Act, 1877.",
    "exact_key_passages": [
      {
        "paragraph_number": 14,
        "quote_text": "By the amendment of 2004, the legislature has made registration of a contract for sale mandatory under section 17A of the Registration Act and section 54A of the Transfer of Property Act. Section 21A of the Specific Relief Act explicitly bars any court from entertaining a suit for specific performance of an unregistered contract for sale."
      }
    ],
    "verification_status": "LAWYER_2_APPROVED",
    "audit_trail": {
      "extracted_by": "Justor Case Intelligence Staging",
      "reviewer_1": "Advocate M. Rahman (SCBA)",
      "reviewer_2": "Advocate K. Hasan (SCBA)",
      "approved_at": "2026-08-14T18:00:00Z"
    }
  },
  {
    "case_id": "SCBD-AD-2008-002",
    "case_title": "Md. Mozibur Rahman vs Government of Bangladesh and others",
    "citation": "60 DLR (AD) 89",
    "court_division": "Appellate Division",
    "year": 2008,
    "judgment_date": "2008-03-24",
    "bench_judges": ["M.M. Ruhul Amin CJ", "Md. Tafazzul Islam J"],
    "subject_area": "Property & Land Law",
    "governing_statutes": [
      {
        "act_name": "The State Acquisition and Tenancy Act, 1950",
        "sections": ["144", "144A"]
      },
      {
        "act_name": "The Evidence Act, 1872",
        "sections": ["35"]
      }
    ],
    "facts_summary": "The dispute pertained to whether the record of rights (RS Khatian) published under Section 144 of the SAT Act creates title on its own in the absence of valid acquisition documents.",
    "legal_issues": [
      "Whether a Khatian (Record of Rights) creates or extinguishes title to immovable property."
    ],
    "ratio_decidendi": "A Khatian or Record of Rights (Porcha) does not create nor extinguish title to immovable property. It only raises a rebuttable presumption of possession and tenancy for revenue collection purposes under Section 144(4) of the SAT Act.",
    "exact_key_passages": [
      {
        "paragraph_number": 9,
        "quote_text": "It is well settled that entry in the record-of-rights does not create title. Record-of-rights is prepared for fiscal purposes, namely, collection of land revenue, and it raises only a rebuttable presumption of correctness regarding possession."
      }
    ],
    "verification_status": "LAWYER_2_APPROVED",
    "audit_trail": {
      "extracted_by": "Justor Case Intelligence Staging",
      "reviewer_1": "Advocate M. Rahman (SCBA)",
      "reviewer_2": "Advocate K. Hasan (SCBA)",
      "approved_at": "2026-08-14T18:00:00Z"
    }
  },
  {
    "case_id": "SCBD-AD-2018-003",
    "case_title": "Md. Nurul Islam vs S.M. Shahjahan and others",
    "citation": "70 DLR (AD) 215",
    "court_division": "Appellate Division",
    "year": 2018,
    "judgment_date": "2018-07-12",
    "bench_judges": ["Syed Mahmud Hossain CJ", "Muhammad Imman Ali J", "Mirza Hussain Haider J"],
    "subject_area": "Civil Procedure & Injunctions",
    "governing_statutes": [
      {
        "act_name": "The Code of Civil Procedure, 1908",
        "sections": ["Order 39, Rule 1", "Order 39, Rule 2"]
      }
    ],
    "facts_summary": "Appeal against the grant of temporary injunction restraining the appellant from construction on disputed land during pendency of a partition suit.",
    "legal_issues": [
      "What are the essential tripartite conditions governing the grant of temporary injunction under Order 39 of the CPC."
    ],
    "ratio_decidendi": "To obtain a temporary injunction under Order 39, Rules 1 and 2 of the CPC, the applicant must establish all three conditions cumulatively: (1) a strong prima facie case, (2) irreparable loss and injury that cannot be compensated in money, and (3) balance of convenience in applicant's favour.",
    "exact_key_passages": [
      {
        "paragraph_number": 11,
        "quote_text": "An order of temporary injunction cannot be granted as a matter of course. The court must be satisfied on three indispensable ingredients: prima facie arguable case, balance of convenience and inconvenience, and irreparable injury."
      }
    ],
    "verification_status": "LAWYER_2_APPROVED",
    "audit_trail": {
      "extracted_by": "Justor Case Intelligence Staging",
      "reviewer_1": "Advocate M. Rahman (SCBA)",
      "reviewer_2": "Advocate K. Hasan (SCBA)",
      "approved_at": "2026-08-14T18:00:00Z"
    }
  },
  {
    "case_id": "SCBD-AD-2012-004",
    "case_title": "Abdul Gafur vs Md. Shamsul Haque",
    "citation": "64 DLR (AD) 54",
    "court_division": "Appellate Division",
    "year": 2012,
    "judgment_date": "2012-02-15",
    "bench_judges": ["Md. Muzammel Hossain CJ", "Surendra Kumar Sinha J"],
    "subject_area": "Property & Land Law",
    "governing_statutes": [
      {
        "act_name": "The State Acquisition and Tenancy Act, 1950",
        "sections": ["96"]
      }
    ],
    "facts_summary": "The pre-emptor filed an application for pre-emption under Section 96 of the SAT Act claiming rights as a co-sharer by inheritance. The vendee contended the applicant was only a co-sharer by purchase.",
    "legal_issues": [
      "Whether a co-sharer by purchase holds statutory pre-emption rights after the 2006 amendment to Section 96 of the SAT Act."
    ],
    "ratio_decidendi": "Following the State Acquisition and Tenancy (Amendment) Act, 2006 (Act No. 34 of 2006), the right of pre-emption under Section 96 is restricted strictly to a co-sharer by inheritance of the holding. A co-sharer by purchase or contiguous tenant has no right of pre-emption under Section 96.",
    "exact_key_passages": [
      {
        "paragraph_number": 8,
        "quote_text": "By the substituting amendment of section 96 in 2006, the legislature intentionally omitted contiguous land owners and co-sharers by purchase. Only a co-sharer in the holding by inheritance is entitled to maintain an application for pre-emption."
      }
    ],
    "verification_status": "LAWYER_2_APPROVED",
    "audit_trail": {
      "extracted_by": "Justor Case Intelligence Staging",
      "reviewer_1": "Advocate M. Rahman (SCBA)",
      "reviewer_2": "Advocate K. Hasan (SCBA)",
      "approved_at": "2026-08-14T18:00:00Z"
    }
  },
  {
    "case_id": "SCBD-HCD-2016-005",
    "case_title": "The State vs Md. Mofazzal Hossain",
    "citation": "68 DLR (HCD) 341",
    "court_division": "High Court Division",
    "year": 2016,
    "judgment_date": "2016-08-22",
    "bench_judges": ["M. Enayetur Rahim J", "J.B.M. Hassan J"],
    "subject_area": "Criminal Procedure & Bail",
    "governing_statutes": [
      {
        "act_name": "The Code of Criminal Procedure, 1898",
        "sections": ["498"]
      }
    ],
    "facts_summary": "Application for anticipatory bail under Section 498 of CrPC in connection with an alleged financial dispute converted into a criminal complaint under Sections 406/420 of Penal Code.",
    "legal_issues": [
      "What are the parameters for granting anticipatory bail under Section 498 CrPC in Bangladesh."
    ],
    "ratio_decidendi": "Anticipatory bail under Section 498 CrPC is an extraordinary prerogative remedy granted only when there is reasonable apprehension of arrest with mala fide intent or where civil disputes are dressed up as criminal offences to cause harassment.",
    "exact_key_passages": [
      {
        "paragraph_number": 12,
        "quote_text": "The power under section 498 of the Code to grant anticipatory bail is of an exceptional character. It must be exercised with caution where the petitioner establishes a prima facie apprehension of arrest based on motivated or frivolous accusations."
      }
    ],
    "verification_status": "LAWYER_2_APPROVED",
    "audit_trail": {
      "extracted_by": "Justor Case Intelligence Staging",
      "reviewer_1": "Advocate M. Rahman (SCBA)",
      "reviewer_2": "Advocate K. Hasan (SCBA)",
      "approved_at": "2026-08-14T18:00:00Z"
    }
  },
  {
    "case_id": "SCBD-AD-2004-006",
    "case_title": "Government of Bangladesh vs Ayesha Khatun",
    "citation": "56 DLR (AD) 130",
    "court_division": "Appellate Division",
    "year": 2004,
    "judgment_date": "2004-06-10",
    "bench_judges": ["Mainur Reza Chowdhury CJ", "K.M. Hasan J"],
    "subject_area": "Family & Succession Law",
    "governing_statutes": [
      {
        "act_name": "The Muslim Family Laws Ordinance, 1961",
        "sections": ["4"]
      }